{"argv":null,"build_epoch":3545526663,"epoch":{"inputs":{"DERIVED_SPEC_DIGEST_V1":3545526663,"GIT_COMMIT_EPOCH":null,"SOURCE_DATE_EPOCH":null,"SPEC_DIGEST_SHA256":"1b1a01ad483fcc07d8cf48dadeab44a6d43132564f442bd754210dbe3017c071","STUNIR_BUILD_EPOCH":null},"selected_epoch":3545526663,"source":"DERIVED_SPEC_DIGEST_V1"},"inputs":[{"kind":"dir","path":"asm","sha256":"baa2c39e20c92c2c5de80de8f900ff26bd34a26744a27bfa07db0c8ee54fb5ae"},{"kind":"dir","path":"spec","sha256":"1b1a01ad483fcc07d8cf48dadeab44a6d43132564f442bd754210dbe3017c071"},{"kind":"file","path":"build/provenance.json","sha256":"5557324185cf300b736a6963d45b5a0c45be077c66ffa64f9260d787a455d369"},{"kind":"file","path":"receipts/ir_bundle_manifest.json","sha256":"ea3d94b29bf1d6fb54ac0248a5e24ec53761f27955ccdaf7e29909959635536e"},{"kind":"file","path":"receipts/ir_manifest.json","sha256":"741623802438ed5b52fdba8aa7b6f2c52e96e523d2f42e5c1bda45848d3c2c3a"},{"kind":"file","path":"tools/prov_emit.c","sha256":"67a65b5413679e72a9179f1137fa74f56841c05971eabf9298d5a1ec8b15a4d9"},{"kind":"file","path":"tools/record_receipt.py","sha256":"99fb69e28815539f238a6df6196ad71f1ff9e79e85b1102b5da5c63b37748879"}],"receipt_core_id_sha256":"f3728f0dd8b24a09502f07a8dde9e2658a386a6f1e77cf17575484c05da9c75b","schema":"stunir.receipt.build.v1","sha256":null,"status":"SKIPPED_TOOLCHAIN","target":"bin/prov_emit","tool":null}
